{
  "schema_version": 1,
  "kind": "curriculum",
  "source_id": "synthetic-alpha",
  "title": "Synthetic course catalogue",
  "courses": [
    {
      "course_id": "basics",
      "title": "Basics",
      "language": "uk",
      "instruction_language": "en",
      "items": [
        {
          "item_id": "hello",
          "item_revision": 1,
          "text": {
            "display": "Привіт",
            "speech": "Приві́т"
          },
          "meaning": "Hello"
        }
      ],
      "lessons": [
        {
          "lesson_id": "lesson-1",
          "title": "Synthetic greeting",
          "modes": [
            "repetition"
          ],
          "repetition_item_ids": [
            "hello"
          ],
          "guided_steps": [],
          "recall_goals": [],
          "topic": null
        }
      ]
    }
  ]
}
