{
  "schema_version": 1,
  "kind": "curriculum",
  "source_id": "synthetic-alpha",
  "title": "Synthetic course catalogue",
  "courses": [
    {
      "course_id": "basics",
      "title": "Basics",
      "language": "uk",
      "instruction_language": "en",
      "items": [],
      "lessons": [
        {
          "lesson_id": "lesson-1",
          "title": "Synthetic greeting",
          "modes": [
            "free_conversation"
          ],
          "repetition_item_ids": [],
          "guided_steps": [],
          "recall_goals": [],
          "topic": "A fictional picnic"
        }
      ]
    }
  ]
}
